{"schema_version":"1.0","increment_id":"P1-I02","phase":1,"lesson":2,"capability":"Represent prediction evidence with named axes and validated tensor transformations.","upstream_evidence":["activities/L02-A1.json","L02-A1-shape-contract.md","P1-I01"],"contract":{"inputs":[{"name":"feature_batch","meaning":"Examples by ordered prediction-time features","type_or_shape":"(batch, features)","available_when":"training and inference"}],"outputs":[{"name":"prediction_batch","meaning":"One prediction for each example","type_or_shape":"(batch, 1)"}],"interfaces":["Named-axis data contract","Known-row transformation test"],"assumptions":["Every producer uses the documented feature order and units"],"trust_boundaries":["Shape-compatible data is rejected when axis semantics or units differ"]},"acceptance_criteria":["Every axis has a name, order, and meaning.","A valid transformation is traced end to end.","A semantic mismatch is detected by a known-row test."],"failure_behavior":["Unknown axis order blocks consumption rather than silently broadcasting.","Unexpected dtype or units produce a contract violation."],"verification":{"procedure":["Open Lesson 2","Trace recorded input and output shapes","Run the known-row calculation","Attempt the rejected transformation"],"expected_evidence":["Axis table","Shape trace","Rejected mismatch"],"automated_command":null},"downstream_consumer":"P1-I03 loss reduction and optimization contract","decision":{"status":"proposed","rationale":"The contract preserves meaning across model and evaluation components.","open_questions":["Which embedding dimensions will later be evaluated for retrieval?"]}}
