{"schema_version":"1.0","increment_id":"P1-I05","phase":1,"lesson":5,"capability":"Task metric threshold and integrated evaluation decision","upstream_evidence":["activities/L05-A1.json","P1-I04 uncertainty record"],"contract":{"inputs":[{"name":"prior_evidence","meaning":"Accepted upstream lesson artifact","type_or_shape":"document"},{"name":"lesson_observations","meaning":"Evidence produced by the current activity","type_or_shape":"structured record"}],"outputs":[{"name":"accepted_increment","meaning":"Task metric threshold and integrated evaluation decision","type_or_shape":"reviewable artifact"}],"interfaces":["Browser lesson activity","Markdown evidence artifact","Acceptance review"],"assumptions":["Learner completes the core interactions before proposing the increment","Compared scenarios preserve stated evaluation boundaries"],"trust_boundaries":["Final test or downstream evidence remains unavailable until its documented use"]},"acceptance_criteria":["Target, horizon, action, and baseline are explicit.","Metric and threshold follow error cost and capacity.","Evaluation protects time or entity boundaries and the final test."],"failure_behavior":["A failed criterion keeps the increment proposed rather than accepted.","Recovery restores the known-good scenario before another comparison."],"verification":{"procedure":["Complete the guided level","Run the challenge failure experiment","Compare evidence with every acceptance criterion","Record accept, revise, or reject"],"expected_evidence":["Completed activity artifact","Failure signal","Recovery result","Decision rationale"],"automated_command":null},"downstream_consumer":"Phase 1 integrated assessment","decision":{"status":"proposed","rationale":"The increment converts lesson observations into a reviewable contract for the next capability.","open_questions":["Does the evidence remain valid under the next lesson's conditions?"]}}
