{"schema_version":"1.0","increment_id":"P1-I01","phase":1,"lesson":1,"capability":"Define and reproduce the first prediction problem and baseline model behavior.","upstream_evidence":["activities/L01-A1.json","L01-A1-model-evidence.md"],"contract":{"inputs":[{"name":"x","meaning":"Prediction-time numeric feature","type_or_shape":"scalar","available_when":"inference"}],"outputs":[{"name":"prediction","meaning":"Estimated continuous target","type_or_shape":"scalar"}],"interfaces":["Browser model controls","Experiment evidence record"],"assumptions":["Training examples represent the intended use population","A line is a useful first baseline"],"trust_boundaries":["Test examples remain separate from parameter fitting"]},"acceptance_criteria":["Normal and failed runs reproduce from recorded controls.","Training and test evidence are reported separately.","Parameters and experiment controls are distinguished."],"failure_behavior":["Unstable updates produce an explicit warning and recovery action.","Curved evidence is identified as a capacity limitation."],"verification":{"procedure":["Open Lesson 1 lab","Run recorded normal settings","Run recorded failure settings","Compare the evidence record"],"expected_evidence":["Weight and bias","Training and test loss","Failure diagnosis"],"automated_command":null},"downstream_consumer":"P1-I02 named data-shape contract","decision":{"status":"proposed","rationale":"This reference contract is accepted only after the learner supplies reproducible evidence.","open_questions":["Which additional feature will later improve the baseline?"]}}
