{"schema_version":"1.0","increment_id":"P2-I03","phase":2,"lesson":8,"capability":"Framework execution state mode and checkpoint contract","upstream_evidence":["activities/L08-A1.json","P2-I02 gradient ledger"],"contract":{"inputs":[{"name":"prior_evidence","meaning":"Accepted upstream lesson artifact","type_or_shape":"document"},{"name":"lesson_observations","meaning":"Evidence produced by the current activity","type_or_shape":"structured record"}],"outputs":[{"name":"accepted_increment","meaning":"Framework execution state mode and checkpoint contract","type_or_shape":"reviewable artifact"}],"interfaces":["Browser lesson activity","Markdown evidence artifact","Acceptance review"],"assumptions":["Learner completes the core interactions before proposing the increment","Compared scenarios preserve stated evaluation boundaries"],"trust_boundaries":["Final test or downstream evidence remains unavailable until its documented use"]},"acceptance_criteria":["Training and evaluation state boundaries are explicit.","Gradient lifecycle order is correct.","Checkpoint manifest can reproduce inference."],"failure_behavior":["A failed criterion keeps the increment proposed rather than accepted.","Recovery restores the known-good scenario before another comparison."],"verification":{"procedure":["Complete the guided level","Run the challenge failure experiment","Compare evidence with every acceptance criterion","Record accept, revise, or reject"],"expected_evidence":["Completed activity artifact","Failure signal","Recovery result","Decision rationale"],"automated_command":null},"downstream_consumer":"P2-I04 model release packet","decision":{"status":"proposed","rationale":"The increment converts lesson observations into a reviewable contract for the next capability.","open_questions":["Does the evidence remain valid under the next lesson's conditions?"]}}
