{"schema_version":"1.0","increment_id":"P2-I06","phase":2,"lesson":10,"capability":"Tested reproducible neural-model reference implementation","upstream_evidence":["phase-projects/phase2/P2-I05.json","labs/engineering_lab_a/EVIDENCE_TEMPLATE.md"],"contract":{"inputs":[{"name":"phase_2_specification","meaning":"Accepted architecture training and generalization contracts","type_or_shape":"P2-I01 through P2-I05"},{"name":"delivery_features","meaning":"Ordered prediction-time project features","type_or_shape":"(batch, 5)"}],"outputs":[{"name":"risk_logit","meaning":"One late-delivery score per project","type_or_shape":"(batch,)"},{"name":"release_evidence","meaning":"Selected checkpoint and protected evaluation results","type_or_shape":"JSON plus checkpoint"}],"interfaces":["Python command-line runner","PyTorch module","pytest verification","JSON evidence artifact"],"assumptions":["Python 3.11 through 3.13","CPU execution is sufficient","Feature order matches checkpoint metadata"],"trust_boundaries":["Test evidence remains sealed until validation selection is complete","Checkpoint loading requires trusted local provenance"]},"acceptance_criteria":["Known-good training and all lab tests pass.","Shapes gradients lifecycle and checkpoint metadata satisfy P2-I01 through P2-I05.","Controlled failure stops without promoting a checkpoint and recovery is reproducible."],"failure_behavior":["Nonfinite or explosive loss stops training and prevents checkpoint promotion.","Shape mismatch reports expected and received shapes before model execution continues."],"verification":{"procedure":["Run the readiness diagnostic","Run known-good training","Run controlled failure and recovery","Run the lab test suite","Complete the evidence template"],"expected_evidence":["Diagnostic output","evidence.json","best-checkpoint.pt","pytest result","P2-I06-tested-reference-implementation.md"],"automated_command":"pytest -q labs/engineering_lab_a/test_model.py"},"downstream_consumer":"Lesson 11 tokenization implementation labs","decision":{"status":"proposed","rationale":"The lab converts the accepted Phase 2 specification into a tested implementation and establishes programming readiness.","open_questions":["Does the learner need additional syntax practice before Lesson 11?"]}}
