{"schema_version":"1.0","increment_id":"P1-I03","phase":1,"lesson":3,"capability":"Train the baseline with an explicit loss, update policy, and failure telemetry.","upstream_evidence":["activities/L03-A1.json","L03-A1-optimization-contract.md","P1-I02"],"contract":{"inputs":[{"name":"predictions","meaning":"Batch model outputs","type_or_shape":"(batch, 1)","available_when":"training"},{"name":"labels","meaning":"Known training targets","type_or_shape":"(batch, 1)","available_when":"training"}],"outputs":[{"name":"loss","meaning":"Scalar training objective","type_or_shape":"scalar"},{"name":"parameter_update","meaning":"Controlled movement based on gradient evidence","type_or_shape":"parameter-shaped"}],"interfaces":["Loss calculation","Optimizer state","Training telemetry"],"assumptions":["Selected loss reflects the stated error cost","Compared runs use the same initialization and budget"],"trust_boundaries":["Optimization evidence cannot access the sealed final test set"]},"acceptance_criteria":["Loss choice follows operational error cost.","Stable and unstable runs are reproducible.","Optimization and release evidence remain distinct."],"failure_behavior":["Divergence crosses a documented threshold and stops comparison.","Recovery resets optimizer state before changing the rate."],"verification":{"procedure":["Run the supported trajectory","Run slow and divergent trajectories","Record failure thresholds","Restore the known-good state"],"expected_evidence":["Loss rationale","Trajectories","Failure signal","Recovery result"],"automated_command":null},"downstream_consumer":"P1-I04 probability and evidence-quality record","decision":{"status":"proposed","rationale":"The optimization contract makes training behavior reproducible without treating falling loss as release proof.","open_questions":["How uncertain are the measured differences across samples?"]}}
